paper_id,title,abstract,year
macss_36,"Intergenerational Changes in Education and Social Mobility in Contemporary China: Based on Gender, Area and Family Size","This study explores the significant changes of the gender gap, regional divide, and family size effect in the context of intergenerational education improvement and social mobility after the launch of China's reform and open-up policy. The reform and open-up policy, initiated in 1978 China, introduced significant social changes including increased urbanization, changes in family structure, shifts in social norms and values. This study will contribute valuable insights into how such large-scale national policy shape and affect social structures and patterns of mobility among different groups of population, and either reinforce or mitigate forms of social inequality. Therefore, intergenerational education improvement and social mobility are the main focuses as well as key indicators in this study to measure the prevalence, magnitude and changes of the gender gap, regional disparities, and family size effect. This study utilizes data from the China Family Panel Studies (CFPS), a nationally representative, longitudinal household survey of over 14,000 families in contemporary China, and mainly multi-linear regression models with interactive effects to investigate the impact of the reform and opening policy. The results of this study indicates that while there are still social inequality and differences among different population groups in modern China, these differences to some extent have been effectively and significantly reduced over time with the influence of the reform and opening policy.",2023
macss_37,Correcting Misperceptions on Indian Whatsapp with Experimental Adaptation: Building an Experimentation Platform on Whatsapp,"This paper explores the challenges associated with India’s digital transformation, with a specific focus on the surge of misinformation via WhatsApp in rural regions. As the world’s second-largest internet user base, India faces unique issues with misinformation, especially due to user-led fact-checking on encrypted platforms and influential religious rhetoric. To address these concerns, a WhatsApp-based surveying tool was developed to directly access rural users’ perspectives and collect a corpus of circulating media. This study aims to understand varying user interactions and sharing tendencies with thematic messages and identify effective misinformation deterrents. The research’s pivotal contribution lies in the newly developed experimen- tation platform, enabling effective data gathering and testing of popular interventions against misinformation using adaptive experimentation.",2023
macss_38,TOWARD A SYSTEMATIC APPROACH TO EX-ANTE FTA IMPACT ESTIMATION ANALYSIS,"A standard approach to the analysis of free trade agreements (FTAs) involves simulating a general equilibrium model of the global economy in response to shocks that reflect trade cost liberalisation. A few methods are common to estimate the scale of these essential trade shocks, but little formal research has gone into evaluating the success of these different approaches. Developing a systematic approach to the evaluation of FTA trade shock estimates is essential to informed policy making in international trade, as well as to the academic literature on the evaluation of FTAs. This paper contributes to the existing small literature focused on estimating trade impacts for use in economic modelling of trade. It extends a framework first used in a paper by [Baier et al., 2019]. This method presented a novel way to evaluate ex-ante trade shock estimation methodologies by posing the issue as a prediction problem to predict ex-post FTA shocks identified through a first stage gravity model. In this paper I extend the original paper’s ex-ante analysis by making use of a wider dataset, as well as adopting recent methodological innovations from the machine learning literature. I find that amongst the most important considerations in making ex-ante FTA impact estimates are whether a model is trained on data excluding outliers and the type of machine learning model chosen. Furthermore, the broader set of data used is found to be important in improving success.",2023
macss_39,Open Particles in Social Medium: Open Collaboration in GitHub,"This thesis proposes an innovative approach for the comprehensive and structured modeling of online open collaboration. By conceptualizing individuals, teams, and collaborative environments as social atoms, molecules, and mediums respectively, it employs concepts and tools from physics and chemistry to illustrate human interactions. This research introduces an analogical framework that retains the fundamental principles of select traditional natural science instruments while also integrating more probabilistic and dynamic elements to address the disparities between the physical and social systems. It applies and adapts two tools and one concept from physics and chemistry - namely the collaborative periodic table (inspired by the periodic table of elements), the probabilistic collaboration equation (based on the reaction equation), and the social superposition state (derived from quantum physics). These tools and concepts are employed to study open collaboration on GitHub, leveraging a dataset sourced from the GitHub open-source community that includes collaborative data from hundreds of thousands of users. The findings of this study not only provide deeper insights into the behavior patterns of open collaboration participants but also illuminate a bottom-up strategy for future sociophysical pursuits.",2023
macss_40,The Popularity of extremism: A computational exploration of extremist political speech on Twitter,"We define political extremism as a duality of internal ideology and external performance and explore whether its performative component on digital platforms is associated with greater popularity. We select three measures of extremism performance supported by prior literature and examine their ability to predict human-labeled extremism in crowd-sourced data. Then we observe how the social media posts’ popularity is dependent on these measures. We find that, out of the three measures, sentiment has a statistically significant association with popularity, but could not yield evidence to confirm it to be a good predictor of extremism.",2023